Category,Subcategory,Source,Description,Example Vehicles,On-Chain Status,Exclusion Reason,Switchboard Oracle Feed,Needs Data Feed Variable Overrides (Privacy)
Cash & Cash Equivalents,Money Market Funds,Government Money Market Funds,"Mutual funds that invest at least 99.5% of total assets in cash, U.S. government securities, and/or repurchase agreements collateralized by government securities. These are the safest and most liquid category of money market fund, exempt from liquidity fees and redemption gates under SEC Rule 2a-7 reforms. They are the default sweep vehicle for most brokerage accounts.","Vanguard Federal Money Market Fund (VMFXX), Fidelity Government Money Market Fund (SPAXX), Schwab Government Money Market Fund (SNVXX), BlackRock Liquidity FedFund (TFDXX), JP Morgan US Government Money Market Fund (MJGXX).",Tokenized,,Yes,No
Cash & Cash Equivalents,Money Market Funds,Prime Money Market Funds,"Money market funds that invest in a broader universe including government securities, corporate commercial paper, certificates of deposit, and repurchase agreements. Prime funds typically offer a yield premium of 10--30 bps over government MMFs because they accept modest credit risk. Following 2024 SEC reforms, institutional prime funds moved to a floating NAV (variable, not pegged to $1.00), while retail prime funds retained a stable NAV.","Vanguard Cash Reserves Federal Money Market Fund (VMRXX), Fidelity Money Market Fund (SPRXX), JP Morgan Prime Money Market Fund (VMVXX), BlackRock Liquidity TempFund (TMPXX), Federated Hermes Prime Obligations Fund (POIXX).",Not Tokenized,,Yes,No
Cash & Cash Equivalents,Money Market Funds,Municipal (Tax-Exempt) Money Market Funds,"Money market funds that invest in short-term municipal securities -- variable-rate demand notes (VRDNs), tax-exempt commercial paper, municipal bonds with short remaining maturities, and tender option bonds. Income is generally exempt from federal income tax, and sometimes from state and local taxes as well, making these funds attractive to investors in high marginal tax brackets. The tax-equivalent yield can exceed that of taxable alternatives for top-bracket taxpayers.","Vanguard Municipal Money Market Fund (VMSXX), Fidelity Municipal Money Market Fund (FTEXX), Schwab Municipal Money Fund (SWTXX), Federated Hermes Municipal Obligations Fund (MOCXX), T. Rowe Price Summit Municipal Money Market Fund (TRSXX).",Not Tokenized,Tax-exempt yield requires US taxpayer status,Yes,No
Cash & Cash Equivalents,Certificates of Deposit (CDs),"Certificates of Deposit (Standard, Jumbo, Brokered)","Bank-issued time deposits with fixed terms and rates. Traditional CDs ($500-$10K min), jumbo CDs ($100K+), and brokered CDs (sold through brokerages, sometimes with secondary market liquidity). All FDIC-insured up to $250K per depositor per institution. Yields typically exceed savings accounts in exchange for locking up funds for a set term.","Marcus by Goldman Sachs CDs, Ally Bank CDs, Discover Bank CDs, Capital One CDs, Synchrony Bank CDs, Bread Financial CDs.",Not Tokenized,FDIC insurance non-transferable; yield uncompetitive without it,Yes,No
Cash & Cash Equivalents,Certificates of Deposit (CDs),"Structured CDs (Callable, Step-Up, Zero-Coupon)","CD variants with non-standard cash flow features. Callable CDs can be redeemed early by the issuer (higher yield for call risk). Step-up CDs increase their coupon rate at set intervals. Zero-coupon CDs are purchased at a discount and pay face value at maturity, with no interim interest payments. All FDIC-insured.","Commonly available through Fidelity, Schwab, and other brokerage CD platforms. Specific issuers rotate; look for CDs labeled ""callable"" with defined call dates.",Not Tokenized,FDIC insurance non-transferable; yield uncompetitive without it,Yes,No
Cash & Cash Equivalents,Commercial Paper,Financial Commercial Paper,"Short-term, unsecured promissory notes issued by banks, insurance companies, broker-dealers, and other financial institutions to fund working capital and short-term obligations. Maturities range from 1 to 270 days (most commonly 30--90 days) to avoid SEC registration requirements. Commercial paper is sold at a discount to face value and redeemed at par; the discount represents the investor's return. It is a critical component of institutional short-term funding markets.","Direct investment requires institutional infrastructure. Indirect access via prime money market funds (SPRXX, TMPXX), ultra-short bond ETFs (JPST, ICSH, MINT, GSY).",Tokenized,,Yes,No
Cash & Cash Equivalents,Commercial Paper,Non-Financial Commercial Paper,"Short-term unsecured promissory notes issued by non-financial corporations (industrial, technology, consumer goods, utilities, etc.) to fund seasonal working capital needs, bridge financing, or short-term operational expenses. Structurally identical to financial CP -- sold at a discount, matures in 1--270 days, requires high credit quality. Non-financial CP issuers are typically large, highly rated corporations with predictable cash flows.","Issuers include Apple, Johnson & Johnson, Procter & Gamble, ExxonMobil, Microsoft. Retail investors access through prime money market funds and ultra-short bond funds.",Not Tokenized,,Yes,No
Cash & Cash Equivalents,Commercial Paper,Asset-Backed Commercial Paper (ABCP),"Short-term notes issued by special-purpose conduits (SPVs) and backed by pools of financial assets -- trade receivables, auto loans, credit card receivables, mortgage loans, or other cash-flow-generating collateral. Unlike unsecured CP, ABCP provides investors with recourse to a segregated asset pool, plus liquidity and credit enhancement facilities provided by sponsoring banks. ABCP was at the center of the 2007--2008 financial crisis when conduits holding mortgage-related assets lost market access.","Retail investors access ABCP indirectly. Major conduit programs are sponsored by Citibank, JPMorgan, BNP Paribas, and other global banks. Holdings appear in prime money market fund portfolio disclosures.",Not Tokenized,,Yes,No
Cash & Cash Equivalents,Commercial Paper,Banker's Acceptances (BAs),"Short-term debt instruments created when a bank ""accepts"" (guarantees) a time draft drawn on it, typically in connection with international trade transactions. The accepting bank unconditionally promises to pay the face amount at maturity, making BAs a dual-obligation instrument (backed by both the drawer/importer and the accepting bank). BAs are sold at a discount and mature at face value, usually within 30--180 days. Once a niche cornerstone of trade finance, BAs have declined significantly in volume as letters of credit and other trade finance instruments have evolved.","Rarely traded as standalone retail products. Found in money market fund portfolio holdings. Trade finance funds (e.g., those offered by specialized asset managers) may include BAs.",Not Tokenized,Largely obsolete instrument; replaced by letters of credit,No,No
Cash & Cash Equivalents,Repurchase Agreements (Repos),Repurchase Agreements (Overnight & Term),"Short-term collateralized lending where one party sells securities with an agreement to repurchase them. Overnight repos settle next day; term repos extend from days to months. Typically collateralized by Treasuries or agency MBS. Core plumbing of short-term funding markets, closely tracking the federal funds rate.","Federal Reserve ON RRP facility (available to eligible counterparties), BNY Mellon Government Securities repo programs. Retail access via government money market funds (VMFXX, SPAXX) that invest heavily in overnight repo.",Tokenized,,Yes,No
Cash & Cash Equivalents,Repurchase Agreements (Repos),Reverse Repo & Tri-Party Repo,"Reverse repos (lending cash against securities collateral, the mirror of a standard repo) and tri-party repos (a clearing bank intermediates collateral management between counterparties). The Fed ON RRP facility is the largest reverse repo program. Tri-party repo is the dominant settlement mechanism for institutional repo markets.","Federal Reserve ON RRP facility (accessed by eligible MMFs like VMFXX, SPAXX). Direct reverse repo with broker-dealers and banks.",Not Tokenized,Mirror of standard repo; not a distinct yield source,No,No
Government & Sovereign Fixed Income,US Treasury Securities,Treasury Bills (T-Bills),"T-Bills are short-term discount securities issued by the US Treasury with maturities of 4, 8, 13, 17, 26, and 52 weeks. They are sold at a discount to par and pay no periodic coupon; the investor's return is the difference between the purchase price and the face value received at maturity. T-Bills are the primary instrument for government cash management and serve as the benchmark short-term risk-free rate.","TreasuryDirect (direct purchase), SGOV (iShares 0--3 Month Treasury Bond ETF), BIL (SPDR Bloomberg 1--3 Month T-Bill ETF), SHV (iShares Short Treasury Bond ETF), Fidelity Government Money Market Fund (SPAXX).",Tokenized,,Yes,No
Government & Sovereign Fixed Income,US Treasury Securities,Treasury Notes (T-Notes),"T-Notes are intermediate-term coupon-bearing securities issued by the US Treasury with maturities of 2, 3, 5, 7, and 10 years. They pay a fixed coupon semiannually and return par at maturity. The 10-year T-Note yield is the single most widely referenced interest rate in global finance, serving as the benchmark for mortgage rates, corporate bond pricing, and general economic sentiment.","TreasuryDirect, IEF (iShares 7--10 Year Treasury Bond ETF), VGIT (Vanguard Intermediate-Term Treasury ETF), SCHR (Schwab Intermediate-Term US Treasury ETF), GOVT (iShares US Treasury Bond ETF).",Not Tokenized,,Yes,No
Government & Sovereign Fixed Income,US Treasury Securities,Treasury Bonds (T-Bonds),"T-Bonds are long-term coupon-bearing securities issued by the US Treasury with a 20-year or 30-year maturity. They pay a fixed semiannual coupon and return par at maturity. The 30-year bond (the ""long bond"") is the longest-duration sovereign benchmark in the US and is closely watched as a barometer of long-term inflation expectations and term premium.","TLT (iShares 20+ Year Treasury Bond ETF), VGLT (Vanguard Long-Term Treasury ETF), EDV (Vanguard Extended Duration Treasury ETF), ZROZ (PIMCO 25+ Year Zero Coupon US Treasury Index ETF), TreasuryDirect.",Partially Tokenized,,Yes,No
Government & Sovereign Fixed Income,US Treasury Securities,Treasury Inflation-Protected Securities (TIPS),"TIPS are inflation-indexed securities issued by the US Treasury with maturities of 5, 10, and 30 years. The principal is adjusted daily based on the Consumer Price Index for All Urban Consumers (CPI-U), and the fixed coupon rate is applied to the adjusted principal, so both coupon payments and the final redemption value increase with inflation. TIPS provide a direct, government-guaranteed real return.","TIP (iShares TIPS Bond ETF), VTIP (Vanguard Short-Term Inflation-Protected Securities ETF), SCHP (Schwab US TIPS ETF), STIP (iShares 0--5 Year TIPS Bond ETF), TreasuryDirect.",Not Tokenized,,Yes,No
Government & Sovereign Fixed Income,US Treasury Securities,Floating Rate Notes (FRNs),"Treasury FRNs are 2-year maturity securities with a coupon that resets weekly based on the most recent 13-week T-Bill auction high rate plus a fixed spread determined at issuance. Introduced in January 2014, they are the only floating-rate instrument issued by the US Treasury. FRNs are designed to provide investors with near-zero interest rate risk while maintaining the credit quality of a direct Treasury obligation.","USFR (WisdomTree Floating Rate Treasury Fund), TFLO (iShares Treasury Floating Rate Bond ETF), FLTR (VanEck IG Floating Rate ETF -- note: this includes non-Treasury floaters), TreasuryDirect.",Not Tokenized,,Yes,No
Government & Sovereign Fixed Income,US Treasury Securities,Series I Savings Bonds (I-Bonds),"I-Bonds are non-marketable, inflation-indexed savings bonds issued by the US Treasury. Their composite rate consists of a fixed rate (set at issuance, constant for the life of the bond) plus a variable semiannual inflation rate based on CPI-U changes. I-Bonds accrue interest for up to 30 years and can be redeemed after 12 months (with a 3-month interest penalty if redeemed before 5 years).","Direct purchase only via TreasuryDirect.gov. No ETFs, mutual funds, or secondary-market vehicles exist.",Not Tokenized,"Non-marketable; non-transferable by law, tied to individual SSN",No,No
Government & Sovereign Fixed Income,US Treasury Securities,Separate Trading of Registered Interest and Principal of Securities (STRIPS),"STRIPS are zero-coupon securities created by ""stripping"" the coupon payments and principal payment of an eligible Treasury note or bond into separate, individually tradeable securities. Each stripped component becomes a standalone zero-coupon bond that is purchased at a discount and pays face value at its specific maturity date. STRIPS are not directly issued by the Treasury but are created by financial institutions from eligible T-Notes and T-Bonds.","EDV (Vanguard Extended Duration Treasury ETF -- holds 20--30 year STRIPS), ZROZ (PIMCO 25+ Year Zero Coupon US Treasury Index ETF), GOVZ (iShares 25+ Year Treasury STRIPS Bond ETF). Direct purchase of individual STRIPS through brokerages.",Not Tokenized,,Yes,No
Government & Sovereign Fixed Income,US Treasury Securities,Series EE Savings Bonds,"Series EE Savings Bonds are non-marketable, fixed-rate savings bonds issued by the US Treasury. They earn a fixed rate of interest set at the time of purchase, compounded semiannually. EE Bonds have a unique feature: if held for 20 years, the Treasury guarantees the bond will double in value (equivalent to a minimum 3.5% annualized return), regardless of the stated fixed rate. They mature at 30 years.",Direct purchase only via TreasuryDirect.gov. No ETFs or mutual fund wrappers.,Not Tokenized,"Non-marketable; non-transferable by law, tied to individual SSN",No,No
Government & Sovereign Fixed Income,US Government Agency Debt,Government National Mortgage Association (GNMA / Ginnie Mae),"GNMA is a wholly owned US government corporation within the Department of Housing and Urban Development (HUD). Unlike other agencies, GNMA securities carry the explicit full faith and credit guarantee of the US government, making them the only mortgage-backed securities with a direct government guarantee. GNMA guarantees the timely payment of principal and interest on MBS pools composed of FHA, VA, USDA, and PIH loans.","GNMA (iShares GNMA Bond ETF), VFIIX (Vanguard GNMA Fund), FGMNX (Fidelity GNMA Fund), direct pool purchases via broker-dealers.",Not Tokenized,,Yes,No
Government & Sovereign Fixed Income,US Government Agency Debt,Federal National Mortgage Association (FNMA / Fannie Mae),"FNMA is a government-sponsored enterprise (GSE) that was chartered by Congress to support the secondary mortgage market by purchasing and securitizing conforming residential mortgages. Fannie Mae issues both MBS (pass-throughs and REMICs) and unsecured corporate debt (benchmark notes, discount notes, callable bonds). While placed under government conservatorship in September 2008, FNMA debt carries only an implicit government guarantee -- not an explicit one.","MBB (iShares MBS ETF -- includes FNMA, FHLMC, GNMA), VMBS (Vanguard Mortgage-Backed Securities ETF), FNMA benchmark notes (direct purchase), AGZ (iShares Agency Bond ETF).",Not Tokenized,,Yes,No
Government & Sovereign Fixed Income,US Government Agency Debt,Federal Home Loan Mortgage Corporation (FHLMC / Freddie Mac),"FHLMC is a GSE chartered by Congress with a mission virtually identical to Fannie Mae: supporting the secondary mortgage market by purchasing and securitizing conforming residential mortgages. Freddie Mac issues MBS (Participation Certificates and structured products) and unsecured debt (reference notes, discount notes, medium-term notes). Like FNMA, FHLMC has been under FHFA conservatorship since September 2008 and carries an implicit government guarantee.","MBB (iShares MBS ETF), VMBS (Vanguard Mortgage-Backed Securities ETF), FHLMC Reference Notes (direct purchase), Schwab US Aggregate Bond ETF (SCHZ -- includes agency MBS).",Not Tokenized,,Yes,No
Government & Sovereign Fixed Income,US Government Agency Debt,Federal Home Loan Banks (FHLB),"The Federal Home Loan Bank System consists of 11 regional cooperative banks that provide liquidity to member financial institutions (commercial banks, credit unions, insurance companies, CDFIs) through secured advances collateralized primarily by residential mortgages. FHLBs are among the largest issuers of agency debt in the world, issuing discount notes, consolidated bonds, callable bonds, floating-rate bonds, and structured notes. FHLB debt is the joint obligation of all 11 FHLBs.","AGZ (iShares Agency Bond ETF), individual FHLB bonds via broker-dealers, FHLB discount notes (commonly held in money market funds), FLOT (iShares Floating Rate Bond ETF -- includes some FHLB floaters).",Not Tokenized,,Yes,No
Government & Sovereign Fixed Income,US Government Agency Debt,Federal Farm Credit Banks (FFCB),"The Farm Credit System is a nationwide network of borrower-owned cooperative lending institutions that provides credit to farmers, ranchers, rural homeowners, agricultural cooperatives, and rural utilities. The Federal Farm Credit Banks Funding Corporation issues consolidated systemwide debt securities on behalf of the system's banks. Like FHLB debt, Farm Credit securities carry an implicit (not explicit) government guarantee and trade at a modest spread over Treasuries.","Individual FFCB bonds via broker-dealers, AGZ (iShares Agency Bond ETF -- includes Farm Credit bonds), agency bond mutual funds.",Not Tokenized,,Yes,No
Government & Sovereign Fixed Income,US Government Agency Debt,Tennessee Valley Authority (TVA),"The Tennessee Valley Authority is a federally owned corporation and the largest public power company in the United States, providing electricity to 10 million people across seven southeastern states. TVA issues bonds and notes to finance its power generation infrastructure (nuclear, coal, gas, hydro, solar). Unlike GSE debt, TVA securities are direct obligations of a federal corporation, though they are not backed by the full faith and credit of the US government. TVA has specific Congressional authorization for its debt program.","Individual TVA bonds via broker-dealers, included in broad agency and government bond indices.",Not Tokenized,,Yes,No
Government & Sovereign Fixed Income,US Municipal Bonds,General Obligation Bonds (GO Bonds),"General obligation bonds are secured by the full faith, credit, and taxing power of the issuing government entity (state, county, city, school district). GO bonds are backed by the issuer's ability to levy taxes -- typically property taxes, but also income taxes, sales taxes, or a combination -- without limitation as to rate or amount (unlimited tax GO) or up to a specified limit (limited tax GO). They are considered the strongest credit structure in the municipal market.","MUB (iShares National Muni Bond ETF), VTEAX (Vanguard Tax-Exempt Bond Index Fund), TFI (SPDR Nuveen Bloomberg Municipal Bond ETF), individual GO bonds via broker-dealers or muni-focused platforms (e.g., BondLink, MunicipalBonds.com).",Not Tokenized,,Yes,No
Government & Sovereign Fixed Income,US Municipal Bonds,Water & Sewer Revenue Bonds,"Water and sewer revenue bonds are secured by the net revenues of a municipal water supply, wastewater treatment, or combined water/sewer utility system. These are among the most creditworthy revenue bonds because water and sewer services are essential, demand is highly inelastic, and the utility typically has rate-setting autonomy through a local governing board. Revenue bond security structures typically include rate covenants, additional bonds tests, and debt service reserve funds.","Individual water/sewer revenue bonds via broker-dealers, included in broad muni ETFs (MUB, VTEB), state-specific muni funds.",Not Tokenized,,Yes,No
Government & Sovereign Fixed Income,US Municipal Bonds,Toll Road / Transportation Revenue Bonds,"Toll road revenue bonds are secured by toll collections from highways, bridges, tunnels, and turnpikes. The credit depends on traffic volume and toll rates, which are influenced by economic activity, fuel prices, land-use patterns, and competition from free alternative routes. Some toll credits also receive tax revenue supplements. These bonds finance critical transportation infrastructure and can carry maturities of 30--40 years to match the long useful life of the assets.","Individual toll road revenue bonds via broker-dealers, included in broad muni indices and ETFs.",Not Tokenized,,Yes,No
Government & Sovereign Fixed Income,US Municipal Bonds,Airport Revenue Bonds,"Airport revenue bonds are secured by revenues generated from airport operations, including airline rates and charges, terminal rents, landing fees, parking, concessions, and passenger facility charges (PFCs). Major hub airports are considered strong credits due to their essential nature, enplanement growth trends, and the contractual structures (use-and-lease agreements) that govern how costs are allocated to airlines. The COVID-19 pandemic severely tested airport credits but most recovered strongly.","Individual airport revenue bonds via broker-dealers, included in broad muni indices and ETFs (MUB, VTEB).",Not Tokenized,,Yes,No
Government & Sovereign Fixed Income,US Municipal Bonds,Hospital / Healthcare Revenue Bonds,"Hospital revenue bonds are secured by the net revenues of not-for-profit hospital systems, academic medical centers, and healthcare networks. These bonds finance construction, expansion, and equipment for healthcare facilities. The credit analysis is complex, focusing on patient volume, payer mix (Medicare/Medicaid vs. commercial insurance), operating margins, physician recruitment, competition, and regulatory environment. Hospital bonds have historically had higher default rates than other major muni revenue bond categories.","Individual hospital revenue bonds via broker-dealers, included in broad muni indices. Nuveen Municipal High Income Fund (NMZ) and other high-yield muni funds often include hospital credits.",Not Tokenized,,Yes,No
Government & Sovereign Fixed Income,US Municipal Bonds,Education Revenue Bonds (Higher Education),"Education revenue bonds are issued by public and private universities, colleges, and community colleges to finance dormitories, academic buildings, research facilities, student centers, and other campus infrastructure. Public university bonds may be secured by tuition revenues, auxiliary enterprise revenues (housing, dining, parking), state appropriations, or a combination. Private university bonds are typically secured by a general obligation of the institution, supported by tuition, endowment income, gifts, and auxiliary revenues.","Individual education revenue bonds via broker-dealers, included in broad muni indices and ETFs.",Not Tokenized,,Yes,No
Government & Sovereign Fixed Income,US Municipal Bonds,Housing Revenue Bonds,"Housing revenue bonds are issued by state and local housing finance agencies (HFAs) to finance below-market-rate mortgage loans for first-time homebuyers and to fund the development of affordable multifamily rental housing. Single-family housing bonds are secured by pools of mortgage loans (often FHA-insured or VA-guaranteed) and funded by tax-exempt bond proceeds. Multifamily housing bonds are secured by mortgage loans on specific affordable housing projects, often with credit enhancement from FHA mortgage insurance, Fannie Mae/Freddie Mac guarantees, or the LIHTC (Low-Income Housing Tax Credit) program.","Individual housing revenue bonds via broker-dealers, state-specific HFA bond programs, included in broad muni indices.",Not Tokenized,,Yes,No
Government & Sovereign Fixed Income,US Municipal Bonds,Tobacco Settlement Revenue Bonds,Tobacco settlement bonds are secured by the payments that participating tobacco manufacturers are required to make to settling states under the 1998 Master Settlement Agreement (MSA). States and territories that were parties to the MSA have securitized their future MSA payment streams by creating special-purpose entities that issue bonds backed by these payments. The credit depends on cigarette consumption volumes (since MSA payments are tied to the number of cigarettes shipped) and the financial health of the tobacco industry.,"Individual tobacco settlement bonds via broker-dealers, included in some high-yield muni funds (e.g., Nuveen High Yield Municipal Bond Fund).",Not Tokenized,,Yes,No
Government & Sovereign Fixed Income,US Municipal Bonds,Stadium & Arena Revenue Bonds,"Stadium and arena bonds finance the construction or renovation of professional sports venues, convention centers, and major entertainment complexes. They are typically secured by a combination of dedicated tax revenues (hotel/motel taxes, car rental taxes, sales taxes in a defined district), facility revenues (naming rights, luxury suite premiums, concessions, parking), and sometimes team lease payments. These bonds are often politically contentious due to the public subsidy of private sports franchises.",Individual stadium/arena revenue bonds via broker-dealers. These bonds are too niche to have dedicated ETFs or funds but are occasionally found in diversified muni portfolios.,Not Tokenized,,Yes,No
